{
  "$schema": "../schemas/software_source_summary.schema.json",
  "schema_version": "ct-mini-software-source-summary-v1",
  "pack_id": "mango_compat",
  "pack_kind": "compatibility",
  "activation": "explicit",
  "description": "Revision-pinned software Source and handle-provenance summaries reproducing operation-mango-public's external-input handlers without adding Mango- or vendor-specific names to CopperTrace's generalized core.",
  "policy": {
    "name_matching": "exact",
    "generalized_core_import": "allow_only_entries_with_core_eligible_true",
    "compatibility_specific_core_eligible": false,
    "declared_input_without_handler": "inventory_only",
    "notes": [
      "This pack must be enabled explicitly as mango_compat.",
      "compatibility_specific entries are exact Mango, vendor, or library-extension symbols and are never generalized-core seeds.",
      "A Mango input marker without a handler is recorded for coverage but does not create a deterministic Source summary."
    ]
  },
  "upstream": {
    "repository": "git@github.com:Ch3m1stryK1ng/operation-mango-public.git",
    "revision": "a26bf93fec67929a9e13d9a1abfde8811e5f2f97",
    "revision_date": "2024-10-30T20:30:58-07:00",
    "files": [
      {"path": "package/argument_resolver/external_function/input_functions.py", "sha256": "ba66046f41d4f5aa77f382e734cf9a339460d8098faa88078c6822d79e15b03e"},
      {"path": "package/argument_resolver/external_function/sink/sink_lists.py", "sha256": "1e33315f826483753db6f3f200472f250cc415567822c8bcdc887f3f32aafbb3"},
      {"path": "package/argument_resolver/external_function/function_declarations/custom.py", "sha256": "12de4595dd745823a42f442fee5ec792d7f6dea6a14a4bedbb12fb45cd514689"},
      {"path": "package/argument_resolver/external_function/function_declarations/nvram.py", "sha256": "fda34cc37a739d094cf463791b2834588625debf7c8de8967724519539f1e62c"},
      {"path": "package/argument_resolver/handlers/base.py", "sha256": "219818fb0317566ac3ed4b818f455aa97892d2501e361f005d6a18e1cccf1a51"},
      {"path": "package/argument_resolver/utils/calling_convention.py", "sha256": "c9d29373290d16140e27c49c5ee76786a27ed7293ab2632fdfa01b8dcaa2178f"},
      {"path": "package/argument_resolver/handlers/network.py", "sha256": "34bde9cff4f4a56e8571699aea4e1d596349a53b3ad5fda3d88bf77b65ecf0b2"},
      {"path": "package/argument_resolver/handlers/unistd.py", "sha256": "98982f820d294bfcedbfeb18badf1b4567359699c52af9517273fc237a9d65be"},
      {"path": "package/argument_resolver/handlers/stdio.py", "sha256": "e5138833beb77f212ac9c8fcd9beb2f4bd1f853f3bf3f73a4f5fbec123be20d6"},
      {"path": "package/argument_resolver/handlers/stdlib.py", "sha256": "53e7f73dddb83ca414b7110e9e530f23239813d9f6c9e455e1152a30510d778f"},
      {"path": "package/argument_resolver/handlers/nvram.py", "sha256": "9bb3f9db9849572b06fabcfdf1cf8bb643a1eabfd93b035cc67e16627b16284a"},
      {"path": "package/argument_resolver/handlers/url_param.py", "sha256": "a6579f53bd9e2a6806c866af0b83084ca5df3b07113dd82fe250d60cba81dae1"}
    ]
  },
  "source_defaults": {
    "max_symbolic_read_bytes": 32,
    "fread_hard_cap_bytes": 4096,
    "handle_tracker": "HandlerBase.fd_tracker",
    "first_synthetic_handle": 3,
    "provenance": [
      {"path": "package/argument_resolver/handlers/base.py", "line": 41, "symbol": "HandlerBase.MAX_READ_SIZE"},
      {"path": "package/argument_resolver/handlers/base.py", "line": 76, "symbol": "HandlerBase.fd_tracker"},
      {"path": "package/argument_resolver/handlers/base.py", "line": 91, "symbol": "HandlerBase.gen_fd"}
    ]
  },
  "initial_handles": [
    {
      "value": 0,
      "name": "stdin",
      "kind": "file_descriptor",
      "ingress_capable": true,
      "source_channel": {"kind": "stdio_stream", "derivation": "fixed fd_tracker entry 0"},
      "provenance": {"path": "package/argument_resolver/handlers/base.py", "line": 77, "symbol": "HandlerBase.fd_tracker[0]"}
    },
    {
      "value": 1,
      "name": "stdout",
      "kind": "file_descriptor",
      "ingress_capable": false,
      "source_channel": {"kind": "none", "derivation": "fixed output-only fd_tracker entry 1"},
      "provenance": {"path": "package/argument_resolver/handlers/base.py", "line": 78, "symbol": "HandlerBase.fd_tracker[1]"}
    },
    {
      "value": 2,
      "name": "stderr",
      "kind": "file_descriptor",
      "ingress_capable": false,
      "source_channel": {"kind": "none", "derivation": "fixed output-only fd_tracker entry 2"},
      "provenance": {"path": "package/argument_resolver/handlers/base.py", "line": 79, "symbol": "HandlerBase.fd_tracker[2]"}
    }
  ],
  "input_function_inventory": [
    {"name": "read", "origin": "direct_literal", "handler_status": "modeled", "compatibility_specific": false, "core_eligible": true, "summary_id": "mango-compat.read", "provenance": [{"path": "package/argument_resolver/external_function/input_functions.py", "line": 7, "symbol": "INPUT_EXTERNAL_FUNCTIONS.read"}]},
    {"name": "fread", "origin": "direct_literal", "handler_status": "modeled", "compatibility_specific": false, "core_eligible": true, "summary_id": "mango-compat.fread", "provenance": [{"path": "package/argument_resolver/external_function/input_functions.py", "line": 8, "symbol": "INPUT_EXTERNAL_FUNCTIONS.fread"}]},
    {"name": "fgets", "origin": "direct_literal", "handler_status": "modeled", "compatibility_specific": false, "core_eligible": true, "summary_id": "mango-compat.fgets", "provenance": [{"path": "package/argument_resolver/external_function/input_functions.py", "line": 9, "symbol": "INPUT_EXTERNAL_FUNCTIONS.fgets"}]},
    {"name": "recv", "origin": "direct_literal", "handler_status": "modeled", "compatibility_specific": false, "core_eligible": true, "summary_id": "mango-compat.recv", "provenance": [{"path": "package/argument_resolver/external_function/input_functions.py", "line": 10, "symbol": "INPUT_EXTERNAL_FUNCTIONS.recv"}]},
    {"name": "recvfrom", "origin": "direct_literal", "handler_status": "modeled", "compatibility_specific": false, "core_eligible": true, "summary_id": "mango-compat.recvfrom", "provenance": [{"path": "package/argument_resolver/external_function/input_functions.py", "line": 11, "symbol": "INPUT_EXTERNAL_FUNCTIONS.recvfrom"}]},
    {"name": "custom_param_parser", "origin": "direct_literal", "handler_status": "modeled", "compatibility_specific": true, "core_eligible": false, "summary_id": "mango-compat.custom-param-parser", "provenance": [{"path": "package/argument_resolver/external_function/input_functions.py", "line": 12, "symbol": "INPUT_EXTERNAL_FUNCTIONS.custom_param_parser"}]},
    {"name": "getenv", "origin": "getter_union", "handler_status": "modeled", "compatibility_specific": false, "core_eligible": true, "summary_id": "mango-compat.getenv", "provenance": [{"path": "package/argument_resolver/external_function/sink/sink_lists.py", "line": 75, "symbol": "GETTER_SINKS.getenv"}, {"path": "package/argument_resolver/external_function/input_functions.py", "line": 13, "symbol": "VULN_TYPES.getter union"}]},
    {"name": "GetValue", "origin": "getter_union", "handler_status": "modeled", "compatibility_specific": true, "core_eligible": false, "summary_id": "mango-compat.getvalue", "provenance": [{"path": "package/argument_resolver/external_function/sink/sink_lists.py", "line": 76, "symbol": "GETTER_SINKS.GetValue"}, {"path": "package/argument_resolver/external_function/input_functions.py", "line": 13, "symbol": "VULN_TYPES.getter union"}]},
    {"name": "acosNvramConfig_get", "origin": "getter_union", "handler_status": "modeled", "compatibility_specific": true, "core_eligible": false, "summary_id": "mango-compat.acos-nvram-config-get", "provenance": [{"path": "package/argument_resolver/external_function/sink/sink_lists.py", "line": 77, "symbol": "GETTER_SINKS.acosNvramConfig_get"}]},
    {"name": "acosNvramConfig_read", "origin": "getter_union", "handler_status": "modeled", "compatibility_specific": true, "core_eligible": false, "summary_id": "mango-compat.acos-nvram-config-read", "provenance": [{"path": "package/argument_resolver/external_function/sink/sink_lists.py", "line": 78, "symbol": "GETTER_SINKS.acosNvramConfig_read"}]},
    {"name": "nvram_get", "origin": "getter_union", "handler_status": "modeled", "compatibility_specific": true, "core_eligible": false, "summary_id": "mango-compat.nvram-get", "provenance": [{"path": "package/argument_resolver/external_function/sink/sink_lists.py", "line": 79, "symbol": "GETTER_SINKS.nvram_get"}]},
    {"name": "nvram_safe_get", "origin": "getter_union", "handler_status": "modeled", "compatibility_specific": true, "core_eligible": false, "summary_id": "mango-compat.nvram-safe-get", "provenance": [{"path": "package/argument_resolver/external_function/sink/sink_lists.py", "line": 80, "symbol": "GETTER_SINKS.nvram_safe_get"}]},
    {"name": "bcm_nvram_get", "origin": "getter_union", "handler_status": "modeled", "compatibility_specific": true, "core_eligible": false, "summary_id": "mango-compat.bcm-nvram-get", "provenance": [{"path": "package/argument_resolver/external_function/sink/sink_lists.py", "line": 81, "symbol": "GETTER_SINKS.bcm_nvram_get"}]},
    {"name": "envram_get", "origin": "getter_union", "handler_status": "modeled", "compatibility_specific": true, "core_eligible": false, "summary_id": "mango-compat.envram-get", "provenance": [{"path": "package/argument_resolver/external_function/sink/sink_lists.py", "line": 82, "symbol": "GETTER_SINKS.envram_get"}]},
    {"name": "wlcsm_nvram_get", "origin": "getter_union", "handler_status": "modeled", "compatibility_specific": true, "core_eligible": false, "summary_id": "mango-compat.wlcsm-nvram-get", "provenance": [{"path": "package/argument_resolver/external_function/sink/sink_lists.py", "line": 83, "symbol": "GETTER_SINKS.wlcsm_nvram_get"}]},